{
  "assignee": "r286-debug-agent",
  "correlation_envelope_id": null,
  "created_at": "2026-09-30T01:23:44Z",
  "description": "",
  "error": {
    "code": "LEASE_EXPIRED",
    "message": "no heartbeat by 2026-09-30T01:23:46Z"
  },
  "heartbeat_at": "2026-09-30T01:23:44Z",
  "input_payload": {},
  "lease_expires_at": "2026-09-30T01:23:46Z",
  "max_retries": 2,
  "output_payload": {},
  "owner": "claudecode",
  "retry_count": 1,
  "state": "queued",
  "task_id": "782ff34b-f5d0-484e-bae5-d97cff2788ae",
  "timeout_ms": 2000,
  "title": "r286-lease-debug",
  "updated_at": "2026-09-30T01:23:47Z"
}